{"algorithm":"typaxis.semantic-container-manifest/1","declared_media_fingerprint":"4e4cd06fa2877135b7c91162e8acd843152c1a616b85009f5e82038c3699cad1","display_fingerprint":"a93e855d466b4eb3ee663928620f87a9752056b4602ec7919e2c7c8ee3c21592","pdf_fingerprint":"35f8db1026ed87f308253d00450df462287803b728e300bcbc00b561a3deaad2","resources":[{"attested_media_kind":"sfnt-truetype-glyf","media_declaration":{"kind":"declared","media_type":"sfnt-truetype-glyf"},"resource_id":0,"resource_kind":"font","sha256":"c399cf1de56ffdc143b97547749a128b49b9356ec89a07a86ab0ca8107b3c50e"},{"attested_media_kind":"ttc-truetype-glyf","media_declaration":{"kind":"declared","media_type":"ttc-truetype-glyf"},"resource_id":1,"resource_kind":"font","sha256":"3a5f1d1bcbda54c4fa3543f0b886d6fa86cec51ed0328a22e10874426112259c"},{"attested_media_kind":"png","media_declaration":{"kind":"declared","media_type":"png"},"resource_id":0,"resource_kind":"image","sha256":"d258ded2ba32f918e46abed09cf3e9f14d274355a65c92fd0a948a4340e24d74"}],"selected_facts":[{"child_owners":[2,4],"display_paint_fingerprint":"cb3bd5283b86c45b5d5defbc7258f9cc6bc198935ee32015fa9a0250d6a2acd2","fragment_index":0,"kind":"result","owner":1,"page_index":0,"pdf_content_stream_fingerprint":"bbadb816e20fd83917fb7e70fa6ff580f394899def94865de231436270d227aa","raster_fingerprint":"bd8994f1ac9a899603da3b983f03408d297033537031d8226fb87e3a67342a3d","selected_fragment_fingerprint":"b69d3de95dcd04a8403fa06390f235e0929c99df9b3471074e03deda84abc4eb","source_span":{"end_byte":19,"source_id":0,"start_byte":0},"style_fingerprint":"036eebd3909dffdc55b95579d33bf6b4fe5131bd4c506fd3c4d54e4b2d93521f"},{"child_owners":[7],"display_paint_fingerprint":"d416331167cdac3077d29d9041079249e35f9e1c8a05c9ec263bc340118496e1","fragment_index":1,"kind":"result","owner":1,"page_index":1,"pdf_content_stream_fingerprint":"f890a371e759e632fdfa6328581e7614219680b9064c7468fb336726a6bc6fd7","raster_fingerprint":"40de8465313d1a3c6fef334a15b4d36c5b9242339afc7d186cc4b53819f0b049","selected_fragment_fingerprint":"cd047b71a7100fb9d17610e78d5c117a4387fce486ee64876eaa87fcc0da4fab","source_span":{"end_byte":19,"source_id":0,"start_byte":0},"style_fingerprint":"036eebd3909dffdc55b95579d33bf6b4fe5131bd4c506fd3c4d54e4b2d93521f"},{"child_owners":[5],"display_paint_fingerprint":"091bce2d41701f9d73d86b78622d6b4f8cb6ee3ec80e346a24f08cf5a7e9212a","fragment_index":0,"kind":"proof","owner":4,"page_index":2,"pdf_content_stream_fingerprint":"323f054d402c7fb693f050d06986ea9432d4acc5eedc9c08c25a782274710e6b","raster_fingerprint":"59a52db3dbcf190e885ae612354cbd234035c101971d9bb51d6fa16dfb8d8d06","selected_fragment_fingerprint":"1baf6cd5234fae64a98f251d57c8c6abffdf29e26dd35f234a457f9ced885386","source_span":{"end_byte":11,"source_id":0,"start_byte":6},"style_fingerprint":"a0e7c523b9da856e895aa92a108e4671672dc0ccc96b87d86659873855a7e8fe"},{"child_owners":[8],"display_paint_fingerprint":"cccfc1f16fc25f1ec6034c8d5980d18ef21aa1c94d0359086903c86f8225a2dc","fragment_index":0,"kind":"exercise","owner":7,"page_index":3,"pdf_content_stream_fingerprint":"ea336b435e281284f570bcc127caadb3795eee28c01ee8a7ce5102b248f40833","raster_fingerprint":"374fb6f2c90161c6eab5db89745cadd8960cb1ee7f0a447f6820cb368edec433","selected_fragment_fingerprint":"21bb8d13975abb3a973d70946a6c28bb4b7e05a38eb444ae3a78661c0185c64d","source_span":{"end_byte":19,"source_id":0,"start_byte":11},"style_fingerprint":"a5ffb4e51536856035b5a53a380900b9a3511476afa2424005213fd7071962e8"}],"selected_layout_fingerprint":"da38f5b616aad700f9c6f007ab18bf2e90c580cfc4dbee5e94a85e577bcba009"}
